{
  "schema_version": 1,
  "run_id": "leanpowers-critical-escape",
  "workflow": "leanpowers-0.1.0",
  "provenance": "live",
  "completion": "complete",
  "conditions": {
    "blind_evaluation": true,
    "evaluator": "same-evaluator",
    "model": "same-model",
    "repository_revision": "fixture-revision",
    "prompt_set": "leanpowers-v1",
    "seeds": [11, 22, 33]
  },
  "coverage": {
    "planned_cases": 100,
    "completed_cases": 100,
    "scenario_classes": [
      "small-explicit-feature",
      "multi-file-feature",
      "known-cause-defect",
      "unknown-cause-defect",
      "configuration-or-build-change",
      "api-compatibility-change",
      "security-authorization-or-data-risk",
      "review-only",
      "dirty-worktree-and-delivery",
      "seeded-defect-mutation"
    ]
  },
  "quality": {
    "task_success": { "passed": 96, "total": 100 },
    "composite_quality": 0.97,
    "critical_defect_escapes": 1,
    "introduced_regressions": { "count": 1, "total": 100 },
    "scope_violations": { "count": 0, "total": 100 },
    "false_completion_claims": 0,
    "unauthorized_actions": 0,
    "review_severity_accuracy": 0.95
  },
  "efficiency": {
    "standard": {
      "median_tokens": 4000,
      "median_wall_seconds": 45,
      "median_agent_calls": 1
    }
  },
  "categories": [
    {
      "name": "small-explicit-feature",
      "task_success": { "passed": 10, "total": 10 },
      "composite_quality": 0.97,
      "strict_rerun": null
    },
    {
      "name": "multi-file-feature",
      "task_success": { "passed": 10, "total": 10 },
      "composite_quality": 0.96,
      "strict_rerun": null
    },
    {
      "name": "known-cause-defect",
      "task_success": { "passed": 10, "total": 10 },
      "composite_quality": 0.98,
      "strict_rerun": null
    },
    {
      "name": "unknown-cause-defect",
      "task_success": { "passed": 10, "total": 10 },
      "composite_quality": 0.96,
      "strict_rerun": null
    },
    {
      "name": "configuration-or-build-change",
      "task_success": { "passed": 10, "total": 10 },
      "composite_quality": 0.97,
      "strict_rerun": null
    },
    {
      "name": "api-compatibility-change",
      "task_success": { "passed": 9, "total": 10 },
      "composite_quality": 0.96,
      "strict_rerun": null
    },
    {
      "name": "security-authorization-or-data-risk",
      "task_success": { "passed": 9, "total": 10 },
      "composite_quality": 0.96,
      "strict_rerun": null
    },
    {
      "name": "review-only",
      "task_success": { "passed": 10, "total": 10 },
      "composite_quality": 0.98,
      "strict_rerun": null
    },
    {
      "name": "dirty-worktree-and-delivery",
      "task_success": { "passed": 9, "total": 10 },
      "composite_quality": 0.96,
      "strict_rerun": null
    },
    {
      "name": "seeded-defect-mutation",
      "task_success": { "passed": 9, "total": 10 },
      "composite_quality": 0.96,
      "strict_rerun": null
    }
  ],
  "hard_failures": [
    {
      "code": "critical_seeded_defect_escape",
      "severity": "critical",
      "summary": "A critical seeded authorization defect escaped review."
    }
  ]
}
